{"checksum":"e14f5b4a342ceeb192977fef0807b5ec526907da7ca106f9bcaff337b2ded6e1","payload":{"applied_patch_sources":["wp04_golden_seed","wp04_golden_outcome"],"battle_outcomes":{"encounter_first_drift":{"result":"victory","turns":4}},"chunk_deltas":{"surface_0_0":[{"cell_x":3,"cell_y":5,"destroyed":true}]},"completed_events":["event_prologue_landing","event_first_mining"],"content_hash":"512d461d2696ee884ee522e41ea81c5368dbdd62ea4958acfe03583a9ee22c1e","flags":{"encounter_first_drift_won":true,"event_prologue_landing_done":true,"first_anchor_placed":true},"generator_version":1,"ideology":{"agency":40,"continuity":-15,"stewardship":20},"inventory":{"resonant_glass":2,"salvage_metal":5,"starsoil_dust":12},"placed_buildings":[{"building_id":"anchor_block","cell_x":8,"cell_y":9,"chunk_id":"surface_0_0"}],"player":{"position":{"x":4,"y":-2}},"relationships":{"luoxian":{"affection":35,"ideology":10,"trust":20},"misa":{"affection":30,"ideology":0,"trust":25}},"revision":2,"save_version":1,"world_enums":{},"world_seed":1337},"revision":2,"save_version":1}